{
  "schemaVersion": 1,
  "id": "ubuntu-24.04.5-arm64",
  "distribution": "Ubuntu Base",
  "version": "24.04.5",
  "architecture": "aarch64",
  "archiveFormat": "tar.gz",
  "url": "https://cdimage.ubuntu.com/ubuntu-base/releases/24.04/release/ubuntu-base-24.04.5-base-arm64.tar.gz",
  "sha256": "a91d5a93010193712d346d761372b7c9db6dfcf093893161c64ca107f05914f2",
  "sourceUrl": "https://cdimage.ubuntu.com/ubuntu-base/releases/24.04/release/",
  "checksumUrl": "https://cdimage.ubuntu.com/ubuntu-base/releases/24.04/release/SHA256SUMS",
  "signature": {
    "scheme": "gpg",
    "url": "https://cdimage.ubuntu.com/ubuntu-base/releases/24.04/release/SHA256SUMS.gpg"
  }
}
